{"$schema":"https://json-schema.org/draft/2020-12/schema","title":"Structural Chemistry Curriculum Scope","type":"object","required":["id","theme","topic","requirements","priority","entity_type","source_refs","status"],"properties":{"id":{"type":"string","pattern":"^sc:curriculum:"},"theme":{"type":"string","minLength":1},"topic":{"type":"string","minLength":1},"requirements":{"type":"array","items":{"type":"string"},"minItems":1},"priority":{"enum":["core","common","extended"]},"entity_type":{"const":"curriculum_scope"},"source_refs":{"type":"array","items":{"type":"string"},"minItems":1,"uniqueItems":true},"status":{"const":"published"}},"additionalProperties":false}
